{
  "schema_version": 1,
  "stage_id": "DG3",
  "round": 1,
  "candidate_id": "sha256:873115d9bc84f763d8ec0670f0e5e320b013dc26faba6e3026395b09ed5c9f33",
  "source_commit": "928b765419e7e84feeaae1a60724a11c318799a8",
  "reviewer_role": "domain-reviewer",
  "invocation_reference": {
    "kind": "claude-code-cli-session",
    "run_id": "DG3-T-DG3-REV-DOM-R1-domain-reviewer-20261008T064710Z-213865e7",
    "session_id": "213865e7-6a8a-41a5-aa8c-307ea33aac97"
  },
  "implementation_author": [
    "backend-workflow-engineer",
    "kpi-benefits-engineer",
    "frontend-ux-engineer",
    "solution-architect",
    "transformation-analyst",
    "devops-engineer",
    "qa-verifier",
    "delivery-orchestrator"
  ],
  "independence_declaration": {
    "reviewer_authored_reviewed_scope": false,
    "statement": "domain-reviewer authored no DG3 implementation, test, register row or ADR in the reviewed candidate. I formed this verdict from my own runs in a complete disposable clone of the freeze commit ec45ef1 (source 928b7654), with my own probes (dg3-api.mjs, dg3-api-extra.mjs, dg3-ui-world.mjs, dg3-ui.mjs). I read the implementers' specs and integration tests only to learn request shapes. I did not open any other reviewer's round-1 record or evidence."
  },
  "assignment": "docs/delivery/assignments/DG3/round-1/domain-reviewer.md",
  "requirements_checked": [
    "REQ-PB-004",
    "REQ-PB-006",
    "REQ-PB-007",
    "REQ-PB-019",
    "REQ-PB-022",
    "REQ-PB-032",
    "REQ-PB-040",
    "REQ-PB-045",
    "REQ-PB-046",
    "REQ-PB-047",
    "REQ-PB-048",
    "REQ-PB-049",
    "REQ-PB-050",
    "REQ-PB-051",
    "REQ-PB-052",
    "REQ-PB-053",
    "REQ-PB-054",
    "REQ-PB-055",
    "REQ-PB-056",
    "REQ-PB-057",
    "REQ-PB-059",
    "REQ-S04-006",
    "REQ-S05-005",
    "REQ-S09-001",
    "REQ-S09-003",
    "REQ-S09-004",
    "REQ-S09-005",
    "REQ-S09-006"
  ],
  "checks_run": [
    {
      "id": "DOM-R1-00-candidate",
      "procedure": "Verify the assignment sha256, HEAD lineage and the candidate ID on the repo and on a complete disposable clone, before and after the runs.",
      "command": "sha256sum <assignment>; git log --oneline -3; git rev-parse --is-shallow-repository; node tools/gates/candidate.mjs --stage DG3 (repo + clone)",
      "environment": "Node 24.21.0; repo /home/user/My-owns at ec45ef1; clone $TMPDIR/review-dom at ec45ef1 (not shallow)",
      "expected": "Assignment sha e78176ce…; ec45ef1 is the freeze commit on 928b7654; candidate sha256:873115d9… with 753 files everywhere.",
      "actual": "The assignment sha256 matches. HEAD ec45ef1 has parent 928b765 and adds only the round-1 assignments, the manifest, progress.md and stages.json. The candidate ID is sha256:873115d9bc84f763d8ec0670f0e5e320b013dc26faba6e3026395b09ed5c9f33 with 753 files on the repo and on the clone, before and after the runs (rv/ removed). The repo HEAD did not move during my run.",
      "exit_status": 0,
      "result": "PASS",
      "evidence": [
        "docs/delivery/test-evidence/DG3/domain/round-1/candidate.log",
        "docs/delivery/test-evidence/DG3/domain/round-1/env.txt"
      ]
    },
    {
      "id": "DOM-R1-01-validators",
      "procedure": "Run the register validator for DG3 and the historical validators for DG2 and DG1, as the assignment requires.",
      "command": "node tools/gates/validate.mjs --register DG3; node tools/gates/validate.mjs --historical --stage DG2; node tools/gates/validate.mjs --historical --stage DG1",
      "environment": "Node 24.21.0, repo at ec45ef1",
      "expected": "Each passes, exit 0.",
      "actual": "'PASS register rules at DG3', 'PASS gate DG2 (historical)', 'PASS gate DG1 (historical)', each exit 0.",
      "exit_status": 0,
      "result": "PASS",
      "evidence": [
        "docs/delivery/test-evidence/DG3/domain/round-1/validators.log"
      ]
    },
    {
      "id": "DOM-R1-02-install",
      "procedure": "Offline frozen install in the clone. If the store cannot satisfy it, use the repo's installed tree and prove that it matches the lockfile.",
      "command": "pnpm install --offline --frozen-lockfile --store-dir <store copy>; diff pnpm-lock.yaml node_modules/.pnpm/lock.yaml; cp -a <repo node_modules trees> <clone>",
      "environment": "Node 24.21.0, pnpm 10.33.0, no network",
      "expected": "A clean install, or a disclosed equivalent tree that matches the lockfile.",
      "actual": "The offline install FAILED with exit 1 (install.log): ERR_PNPM_NO_OFFLINE_TARBALL for @fastify/cookie 11.0.2, because the local store lacks that tarball and the sandbox has no network. A second offline install failed with EROFS (pnpm writes a project link into the read-only store). Neither is a candidate defect. The repo's node_modules/.pnpm/lock.yaml is byte-identical to pnpm-lock.yaml, so I copied the repo's node_modules trees into the clone with cp -a, and every later check ran on that lockfile-identical tree.",
      "exit_status": 0,
      "result": "PASS",
      "evidence": [
        "docs/delivery/test-evidence/DG3/domain/round-1/install.log",
        "docs/delivery/test-evidence/DG3/domain/round-1/env.txt"
      ]
    },
    {
      "id": "DOM-R1-03-typecheck-build-lint-test-contrast",
      "procedure": "pnpm -r typecheck, pnpm -r build, pnpm lint, pnpm test and the contrast check on Node 22 and on Node 24, in the clone.",
      "command": "bash docs/delivery/test-evidence/DG3/domain/round-1/checks.sh",
      "environment": "Node 22.22.2 and 24.21.0, pnpm 10.33.0, clone at ec45ef1",
      "expected": "Every log ends '### exit=0'.",
      "actual": "All ten logs end '### exit=0'. Tests: 80 files, 1528/1528 passed on both versions. Disclosed non-failure lines: the Fastify FSTDEP022 deprecation warning in the test logs, Vite's chunk-size advisory in the build logs, and the three documented prohibited contrast pairs ('PASS contrast: 50 pairs meet WCAG AA; 3 prohibited pairs fail as documented'). Lint ran before any probe was added to the clone.",
      "exit_status": 0,
      "result": "PASS",
      "evidence": [
        "docs/delivery/test-evidence/DG3/domain/round-1/checks.sh",
        "docs/delivery/test-evidence/DG3/domain/round-1/typecheck-node22.log",
        "docs/delivery/test-evidence/DG3/domain/round-1/typecheck-node24.log",
        "docs/delivery/test-evidence/DG3/domain/round-1/build-node22.log",
        "docs/delivery/test-evidence/DG3/domain/round-1/build-node24.log",
        "docs/delivery/test-evidence/DG3/domain/round-1/lint-node22.log",
        "docs/delivery/test-evidence/DG3/domain/round-1/lint-node24.log",
        "docs/delivery/test-evidence/DG3/domain/round-1/test-node22.log",
        "docs/delivery/test-evidence/DG3/domain/round-1/test-node24.log",
        "docs/delivery/test-evidence/DG3/domain/round-1/contrast-node22.log",
        "docs/delivery/test-evidence/DG3/domain/round-1/contrast-node24.log"
      ]
    },
    {
      "id": "DOM-R1-04-sequencing",
      "procedure": "Live API, End-to-End transformation with distinct synthetic people (TL, SP, FIN, WL). Check: submit, select and launch before G1; readiness before and after the diagnostic; G1 decision without, with partial, with false and with all three agreements; Outcome before activity (no link, an outcome without a KPI, then with a KPI); launch before G2, after G2 only, and after G2+G3 while selected-unfunded and once funded.",
      "command": "bash with-stack.sh bash run-all.sh (dg3-api.mjs), stack-run-2",
      "environment": "PostgreSQL 16 on 127.0.0.1:26401, API AUTH_MODE=dev on :26402, Node 24.21.0",
      "expected": "B0009/B0011/B0012/B0032 and ADR-0021 §3/§8/§9 literally: 422 invalid-transition g1_not_approved before G1; readiness lists economics … technology; G1 approve without the three agreements 422 and nothing written; 'Outcome before activity' validation; launch 422 'North Star, outcomes and target state not yet approved' until G2+G3, then 422 selected_unfunded, then 200 once funded.",
      "actual": "All as expected. Submit before G1: 422 urn:mth:problem:invalid-transition initiative.g1_not_approved, and the detail names the leadership agreement on problem, baseline and material value pools. Select and launch of a draft: 422. Readiness: missingDiagnosticAreas = the five B0012 areas, then [] after the T01 items. G1 approve without agreements: 422 gate.g1_agreements_required, with the three pointers. Partial or false agreements: 422. G1 stays submitted at the same version. With all three: 201, recording the three agreement rows. Submit without a link: 422 validation 'Outcome before activity…'. An outcome without a KPI is still refused, and with a KPI the submit is 200. A contribution without an outcome: 400 /outcomeId. Launch before G2/G3, and after G2 only: 422 direction_not_approved with the exact B0009 text. After G3: 422 initiative.selected_unfunded. Once FIN funds it: 200 launched.",
      "exit_status": 0,
      "result": "PASS",
      "requirements": [
        "REQ-PB-004",
        "REQ-PB-006",
        "REQ-PB-007",
        "REQ-PB-022",
        "REQ-PB-032"
      ],
      "evidence": [
        "docs/delivery/test-evidence/DG3/domain/round-1/dg3-api.mjs",
        "docs/delivery/test-evidence/DG3/domain/round-1/dg3-api.log",
        "docs/delivery/test-evidence/DG3/domain/round-1/stack-run-2.log"
      ]
    },
    {
      "id": "DOM-R1-05-modular-and-waiver",
      "procedure": "Modular transformation: inherited approval of G1 (pending, recorder self-accept, delegated accept, unverified evidence, verified + accepted by the SP); gate list, gate view and readiness. End-to-End: G3 waiver (blank reason, self-accept, SP accept) and readiness.",
      "command": "dg3-api.mjs (REQ-PB-004.modular-*) and dg3-api-extra.mjs, stack-run-2",
      "environment": "as DOM-R1-04",